TrackID,TrackName,AlbumName,ArtistName,ReleaseDate,Duration(ms),PopularityIndex,URL
1vYXt7VSjH9JIM5oRRo7vA,Dance The Night - From Barbie The Album,Dance The Night (From Barbie The Album),Dua Lipa,2023-05-25,176579,97,https://open.spotify.com/track/1vYXt7VSjH9JIM5oRRo7vA
2ekn2ttSfGqwhhate0LSR0,New Rules,Dua Lipa (Deluxe),Dua Lipa,2017-06-02,209320,83,https://open.spotify.com/track/2ekn2ttSfGqwhhate0LSR0
2FlcxnvybdwpaMmMhaRtSN,Don't Start Now,Future Nostalgia (The Moonlight Edition),Dua Lipa,2021-02-11,183290,70,https://open.spotify.com/track/2FlcxnvybdwpaMmMhaRtSN
0v2boHmWtxMTD2REGN8MbK,Levitating (feat. DaBaby),Future Nostalgia (The Moonlight Edition),"Dua Lipa, DaBaby",2021-02-11,203064,70,https://open.spotify.com/track/0v2boHmWtxMTD2REGN8MbK
6zSpb8dQRaw0M1dK8PBwQz,Cold Heart - PNAU Remix,Cold Heart (PNAU Remix),"Elton John, Dua Lipa, PNAU",2021-08-13,202735,86,https://open.spotify.com/track/6zSpb8dQRaw0M1dK8PBwQz
5eTNdkstwKaNahHf41fJ9u,Hotter Than Hell,Dua Lipa (Deluxe),Dua Lipa,2017-06-02,187957,69,https://open.spotify.com/track/5eTNdkstwKaNahHf41fJ9u
5UncbfPKpWlxsWWyhmM87l,Physical,Future Nostalgia (The Moonlight Edition),Dua Lipa,2021-02-11,193829,69,https://open.spotify.com/track/5UncbfPKpWlxsWWyhmM87l
5CSKbHjpqborGnlzagyaDo,Love Again,Future Nostalgia (The Moonlight Edition),Dua Lipa,2021-02-11,258004,70,https://open.spotify.com/track/5CSKbHjpqborGnlzagyaDo
76cy1WJvNGJTj78UqeA5zr,IDGAF,Dua Lipa (Deluxe),Dua Lipa,2017-06-02,217946,81,https://open.spotify.com/track/76cy1WJvNGJTj78UqeA5zr
7ef4DlsgrMEH11cDZd32M6,One Kiss (with Dua Lipa),One Kiss (with Dua Lipa),"Calvin Harris, Dua Lipa",2018-04-06,214846,88,https://open.spotify.com/track/7ef4DlsgrMEH11cDZd32M6
4PULMUg3AwudcRCzvVmgXT,Break My Heart,Future Nostalgia (The Moonlight Edition),Dua Lipa,2021-02-11,221820,67,https://open.spotify.com/track/4PULMUg3AwudcRCzvVmgXT
6pbKWWP8WwTaP5TbSq1vCA,Hallucinate,Future Nostalgia (The Moonlight Edition),Dua Lipa,2021-02-11,208505,66,https://open.spotify.com/track/6pbKWWP8WwTaP5TbSq1vCA
1diS6nkxMQc3wwC4G1j0bh,We're Good,Future Nostalgia (The Moonlight Edition),Dua Lipa,2021-02-11,165506,76,https://open.spotify.com/track/1diS6nkxMQc3wwC4G1j0bh
7fYRg3CEbk6rNCuzNzMT06,Potion (with Dua Lipa & Young Thug),Potion (with Dua Lipa & Young Thug),"Calvin Harris, Dua Lipa, Young Thug",2022-05-27,214459,72,https://open.spotify.com/track/7fYRg3CEbk6rNCuzNzMT06
7kJlTKjNZVT26iwiDUVhRm,Blow Your Mind (Mwah),Blow Your Mind (Mwah),Dua Lipa,2016-08-26,178583,67,https://open.spotify.com/track/7kJlTKjNZVT26iwiDUVhRm
1V4uMdCH6aDZire0vVqnXW,Prisoner (feat. Dua Lipa),Future Nostalgia (The Moonlight Edition),"Miley Cyrus, Dua Lipa",2021-02-11,169338,64,https://open.spotify.com/track/1V4uMdCH6aDZire0vVqnXW
5N4erncE7kuUccm7zEmwzk,Electricity (with Dua Lipa),Electricity (with Dua Lipa),"Silk City, Dua Lipa, Diplo, Mark Ronson",2018-09-06,238173,73,https://open.spotify.com/track/5N4erncE7kuUccm7zEmwzk
7mFj0LlWtEJaEigguaWqYh,Sweetest Pie,Sweetest Pie,"Megan Thee Stallion, Dua Lipa",2022-03-11,201334,74,https://open.spotify.com/track/7mFj0LlWtEJaEigguaWqYh
2ygfHXyt3gvyhvKrNJU61n,New Rules - Initial Talk Remix,New Rules (Initial Talk Remix),"Dua Lipa, Initial Talk",2017-11-24,224549,59,https://open.spotify.com/track/2ygfHXyt3gvyhvKrNJU61n
1ixphys4A3NEXp6MDScfih,Be the One,Be the One,Dua Lipa,2015-10-30,202914,70,https://open.spotify.com/track/1ixphys4A3NEXp6MDScfih
5tFAwDNw4K6KYKCWtta7pe,Fever,Future Nostalgia (The Moonlight Edition),"Dua Lipa, Angèle",2021-02-11,156910,63,https://open.spotify.com/track/5tFAwDNw4K6KYKCWtta7pe
7jr3iPu4O4bTCVwLMbdU2i,Kiss and Make Up,Dua Lipa (Complete Edition),"Dua Lipa, BLACKPINK",2018-10-19,189173,76,https://open.spotify.com/track/7jr3iPu4O4bTCVwLMbdU2i
0pk1hxhJLBSZZ5RKBhcwOa,Levitating (feat. Madonna and Missy Elliott) [The Blessed Madonna Remix],Levitating (feat. Madonna and Missy Elliott) [The Blessed Madonna Remix],"Dua Lipa, Madonna, Missy Elliott, The Blessed Madonna",2020-08-13,250280,62,https://open.spotify.com/track/0pk1hxhJLBSZZ5RKBhcwOa
6boViHmG6c8ubzxTvcMoJY,Pretty Please,Future Nostalgia (The Moonlight Edition),Dua Lipa,2021-02-11,194607,64,https://open.spotify.com/track/6boViHmG6c8ubzxTvcMoJY
3iYNJX4FTRGlfMQySjlGNr,Future Nostalgia,Future Nostalgia (The Moonlight Edition),Dua Lipa,2021-02-11,184881,61,https://open.spotify.com/track/3iYNJX4FTRGlfMQySjlGNr
2GPCE96x9Go6acdDt8ex6p,Un Día (One Day),Future Nostalgia (The Moonlight Edition),"J Balvin, Dua Lipa, Bad Bunny, Tainy",2021-02-11,231815,62,https://open.spotify.com/track/2GPCE96x9Go6acdDt8ex6p
1v3bR4v6SruaE8efrTUqqp,Lost In Your Light (feat. Miguel),Lost in Your Light (feat. Miguel),"Dua Lipa, Miguel",2017-04-21,203769,60,https://open.spotify.com/track/1v3bR4v6SruaE8efrTUqqp
4Ulqu89XempybuL8ApUeqL,Cool,Future Nostalgia (The Moonlight Edition),Dua Lipa,2021-02-11,209583,61,https://open.spotify.com/track/4Ulqu89XempybuL8ApUeqL
48QmG1dfvMuYLxMPt7KSRA,No Lie,Mad Love The Prequel,"Sean Paul, Dua Lipa",2018-06-29,221176,84,https://open.spotify.com/track/48QmG1dfvMuYLxMPt7KSRA
3pyodt4pb554dMz8fCv7oi,Good In Bed,Future Nostalgia (The Moonlight Edition),Dua Lipa,2021-02-11,218754,61,https://open.spotify.com/track/3pyodt4pb554dMz8fCv7oi
1IdDtg7GhWfHYEWDymq3d2,If It Ain’t Me,Future Nostalgia (The Moonlight Edition),Dua Lipa,2021-02-11,195351,65,https://open.spotify.com/track/1IdDtg7GhWfHYEWDymq3d2
4szI7zRh7kLApCSqiB6R7b,Boys Will Be Boys,Future Nostalgia (The Moonlight Edition),Dua Lipa,2021-02-11,166266,59,https://open.spotify.com/track/4szI7zRh7kLApCSqiB6R7b
3ebXMykcMXOcLeJ9xZ17XH,Scared to Be Lonely,Scared to Be Lonely,"Martin Garrix, Dua Lipa",2017-01-27,220883,79,https://open.spotify.com/track/3ebXMykcMXOcLeJ9xZ17XH
1LPGXjVWl8EnrnyaOgPpBm,Begging,Dua Lipa (Complete Edition),Dua Lipa,2018-10-19,194106,58,https://open.spotify.com/track/1LPGXjVWl8EnrnyaOgPpBm
4P76CEIXrrWT2cgS1YrTMr,Genesis,Dua Lipa (Deluxe),Dua Lipa,2017-06-02,205720,60,https://open.spotify.com/track/4P76CEIXrrWT2cgS1YrTMr
0mDGNetRxywxqgiXFbagZh,No Goodbyes,Dua Lipa (Deluxe),Dua Lipa,2017-06-02,216080,60,https://open.spotify.com/track/0mDGNetRxywxqgiXFbagZh
1oXHXIB8rHgwHSsPRNjEzn,Last Dance,Dua Lipa (Deluxe),Dua Lipa,2017-06-02,228976,60,https://open.spotify.com/track/1oXHXIB8rHgwHSsPRNjEzn
5600nq7TiBraBX2jobyJ3l,"Swan Song - From the Motion Picture ""Alita: Battle Angel""","Swan Song (From the Motion Picture ""Alita: Battle Angel"")",Dua Lipa,2019-01-24,182074,61,https://open.spotify.com/track/5600nq7TiBraBX2jobyJ3l
5fK0Q3j2iUcQtiRDXlPW0K,Want To,Want To,Dua Lipa,2018-09-06,211817,58,https://open.spotify.com/track/5fK0Q3j2iUcQtiRDXlPW0K
3dD9yyYTQ73SZvyOygyKva,High (& Dua Lipa),Fifty Shades Freed (Original Motion Picture Soundtrack),"Whethan, Dua Lipa",2018-02-09,196706,66,https://open.spotify.com/track/3dD9yyYTQ73SZvyOygyKva
7wIYDzWW82O6Rc4vGuzjND,"I'm Not the Only One - Live from Spotify, London",Spotify Session,Dua Lipa,2016-07-08,195840,64,https://open.spotify.com/track/7wIYDzWW82O6Rc4vGuzjND
5E5MqaS6eOsbaJibl3YeMZ,Homesick,Dua Lipa (Deluxe),Dua Lipa,2017-06-02,230480,65,https://open.spotify.com/track/5E5MqaS6eOsbaJibl3YeMZ
4Wmjt3ICd1G0geHb2Loho1,Thinking 'Bout You,Thinking 'Bout You,Dua Lipa,2017-01-06,171946,57,https://open.spotify.com/track/4Wmjt3ICd1G0geHb2Loho1
4VZXB1paIf867OlmQg89GU,New Love,New Love,Dua Lipa,2015-08-21,271934,56,https://open.spotify.com/track/4VZXB1paIf867OlmQg89GU
7rfiXyFb5M9BqdkvKvVEiB,"My Love (feat. Major Lazer, WizKid, Dua Lipa)",Shine,"Wale, Major Lazer, Wizkid, Dua Lipa",2017-04-28,228706,60,https://open.spotify.com/track/7rfiXyFb5M9BqdkvKvVEiB
4FuZofNMHdtsEdrsqwF3xR,That Kind Of Woman,Future Nostalgia (The Moonlight Edition),Dua Lipa,2021-02-11,200108,61,https://open.spotify.com/track/4FuZofNMHdtsEdrsqwF3xR
4U1TYTYFoFXfhTEGwLlTH1,Room for 2,Room For 2,Dua Lipa,2016-10-28,208689,54,https://open.spotify.com/track/4U1TYTYFoFXfhTEGwLlTH1
5nMkd5cq4JPZqAoQTXv8Wm,I'd Rather Go Blind - Live,Live Acoustic EP,Dua Lipa,2017-12-08,156481,56,https://open.spotify.com/track/5nMkd5cq4JPZqAoQTXv8Wm
